<?xml version="1.0" encoding="UTF-8"?>
<x:biblioteca xmlns:xsi="http://www.w3.org/2001/XMLSchema-instance" xmlns="http://www.bibliotecadiportobuffole.com" xmlns:x="http://www.bibliotecadiportobuffole.com" xsi:schemaLocation="http://www.bibliotecadiportobuffole.com schema.xsd">

<Libri>
	<libro ISBN="978-88-06-21646-7" lang="it">
	<titolo>Norwegian wood</titolo>
	<sottotitolo>Tokyo blues</sottotitolo>
	<autore>
		<nome>Haruki</nome>
		<cognome>Murakami</cognome>
	</autore>
	<annoPubblicazione>1987</annoPubblicazione>
	<edizione>
		<casaEditrice>Einaudi</casaEditrice>
		<edizione>1</edizione>
		<collana>Super ET</collana>
		<annoEdizione>2006</annoEdizione>
		<ristampa>2015</ristampa>
	</edizione>
	<trama>
	<p>Uno dei più clamorosi successi letterari giapponesi di tutti i tempi è anche il libro più intimo, introspettivo di Murakami, che qui si stacca dalle
	atmosfere oniriche e surreali che lo hanno reso famoso, per esplorare il mondo in ombra dei sentimenti e della solitudine.</p>
	<p><span xml:lang="en">Norwegian wood</span> è anche un grande romanzo sull'adolescenza, sul conflitto tra il desiderio di essere integrati nel mondo
	degli altri per entrare vittoriosi nella vita adulta e il bisogno irrinunciabile di essere sé stessi, costi quel che costi. Come il giovane Holden, Toru è continuamente assalito dal dubbio di aver sbagliato o poter sbagliare nelle sue scelte di vita e di amore, ma è anche guidato da un ostinato e personale senso della morale e da un'istintiva avversione per tutto ciò che sa di costruito. Diviso tra due ragazze, Naoko e Midori, che lo attirano entrambe con forza irresistibile, Toru non può fare altro che decidere. O aspettare che la vita(e la morte) decidano per lui.</p>
	</trama>
	<copertina src="resources/libri/Norwegian_wood.png" alt="copertina di Norwegian wood"/>
	<quantita>1</quantita>
	</libro>
	<libro ISBN="978-1-85326-041-4" lang="en">
			<titolo>Il grande Gatsby</titolo><autore>
			<nome>Scott</nome>
			<cognome>Fitzgerald</cognome><secondoNome>Francis</secondoNome></autore>
			<annoPubblicazione>1925</annoPubblicazione>
			<edizione>
			<casaEditrice>Wordsorth classics</casaEditrice></edizione>
			<trama><p>Ambientato a <span xml:lang="en">New York</span> e a <span xml:lang="en">Long Island</span> durante l'estate del 1922, Il grande Gatsby è il più acuto ritratto dell'anima dell'età del <span xml:lang="en">jazz</span>, con le sue contraddizioni, il suo vittimismo e la sua tragicità. La storia, che seguendo la tecnica di <span xml:lang="en">Henry James</span> viene raccontata da uno dei personaggi, narra la tragedia del mito americano che aveva retto il paese dai tempi dello sbarco a <span xml:lang="en">Plymouth Rock</span> e può essere considerata l'autobiografia spirituale di Fitzgerald che, ad un certo punto della sua vita, chiuso con l'alcolismo e con la vita da <span xml:lang="en">playboy</span>, voleva capire quali fossero stati gli ostacoli che avevano fatto inabissare la sua esistenza.</p></trama>
			<copertina src="../Public_html/resources/copertineLibri/il_grande_gatsby.jpg" alt="Copertina del libro il grande Gatsby"/>
			<quantita>1</quantita>
			</libro>
			</Libri>

<Utenti>
	<utente>
		<user>mario94</user>
		<nome>Mario</nome>
		<cognome>Rossi</cognome>
		<annoNascita>1994</annoNascita>
		<mail>mariorossi@gmail.com</mail>
		<numeroTessera>000001</numeroTessera>
		<password>ciaograzie</password>
	</utente>
	<utente>
		<user>mario96</user>
		<nome>Mario</nome>
		<cognome>Rossi</cognome>
		<annoNascita>1994</annoNascita>
		<mail>mariorossi@gmail.com</mail>
		<numeroTessera>000001</numeroTessera>
		<password>ciaograzie</password>
	</utente>

				<utente>
					<user>zaidan90</user>
					<nome>Gino</nome>
					<cognome>Zaidan</cognome>
					<annoNascita>1990</annoNascita>
					<mail>zaidan90@hotmail.it</mail>
					<password>ciaograzie</password>
				</utente>				
				<utente>
					<user>fbizzaro</user>
					<nome>Francesco</nome>
					<cognome>Bizzaro</cognome>
					<annoNascita>1994</annoNascita>
					<mail>fbizzaro@gmail.com</mail>
					<password>123sweg123</password>
				</utente>
				<utente>
					<user>gbruni</user>
					<nome>Giorgio</nome>
					<cognome>Bruni</cognome>
					<annoNascita>1987</annoNascita>
					<mail>gbruni@gmail.com</mail>
					<password>ciaograzie</password>
				</utente>
				<utente>
					<user>enriquad</user>
					<nome>Enrico</nome>
					<cognome>Chiara</cognome>
					<annoNascita>1991</annoNascita>
					<mail>enriquad@gmail.com</mail>
					<password>ciaograzie</password>
				</utente>
				<utente>
					<user>boriky</user>
					<nome>Riccardo</nome>
					<cognome>Rizzo</cognome>
					<annoNascita>1993</annoNascita>
					<mail>boriky@gmail.com</mail>
					<password>ciaograzie</password>
				</utente>
				</Utenti>

<Prenotazioni>
	<prenotazione>
		<libro>978-88-06-21646-7</libro>
		<utente>maario</utente>
		<dataInizio>2016-04-12</dataInizio>
		<dataFine>2016-04-22</dataFine>
		<restituito>1</restituito>
		<dataRestituzione>2016-04-21</dataRestituzione>
	</prenotazione>
</Prenotazioni>

<Prestiti>
	<prestito>
		<libro>978-88-06-21646-7</libro>
		<tesseraUtente>000001</tesseraUtente>
		<dataInizio>2016-04-13</dataInizio>
		<dataFine>2016-04-22</dataFine>
		<restituito>1</restituito>
		<dataRestituzione>2016-04-21</dataRestituzione>
	</prestito>
</Prestiti>

<Voti>
	<voto>
		<libro>978-88-06-21646-7</libro>
		<utente>maario</utente>
		<voto>8.5</voto>
	</voto>
</Voti>

<Commenti>
	<commento>
		<libro>978-88-06-21646-7</libro>
		<utente>maario</utente>
		<commento><p>Questo libro è molto profondo.</p></commento>
	</commento>
</Commenti>
</x:biblioteca>
